{
  "record_id": "f0e1d2c3-4b5a-6978-8796-a5b4c3d2e1f0",
  "schema_version": "1.0",
  "asset_ref": "pseudo-7f3c-a42b",
  "peer_ref": "203.0.113.4",
  "flow_meta": {
    "start_ts": "2026-04-12T00:00:00Z",
    "end_ts": "2026-04-12T12:00:00Z",
    "duration_s": 43200,
    "protocol": "tcp",
    "src_port": 49234,
    "dst_port": 443,
    "direction": "egress",
    "vlan": 10,
    "sensor_id": "sensor-edge-3"
  },
  "features": {
    "fwd_packets": 720,
    "bwd_packets": 718,
    "total_bytes_fwd": 184320,
    "total_bytes_bwd": 92160,
    "pkt_len_mean": 192.1,
    "pkt_len_std": 12.4,
    "pkt_len_max": 256,
    "pkt_len_min": 128,
    "fwd_pkt_len_mean": 256.0,
    "fwd_pkt_len_std": 8.1,
    "bwd_pkt_len_mean": 128.3,
    "bwd_pkt_len_std": 7.2,
    "iat_mean": 60.4,
    "iat_std": 1.8,
    "iat_min": 57.9,
    "iat_max": 62.7,
    "fwd_iat_mean": 60.4,
    "fwd_iat_std": 1.8,
    "bwd_iat_mean": 60.4,
    "bwd_iat_std": 1.8,
    "flow_bytes_per_s": 6.4,
    "flow_packets_per_s": 0.0333,
    "syn_count": 1,
    "ack_count": 1437,
    "fin_count": 1,
    "rst_count": 0,
    "psh_count": 720,
    "urg_count": 0,
    "init_win_bytes_fwd": 65535,
    "init_win_bytes_bwd": 64240,
    "active_mean": 0.18,
    "active_std": 0.04,
    "idle_mean": 60.2,
    "idle_std": 1.8,
    "payload_entropy_bits_per_byte": 4.2,
    "ja3": "e7d705a3286e19ea42f587b344ee6865"
  },
  "derived": {
    "anomaly_score": 0.74,
    "baseline_percentile": 0.99,
    "cluster_id": "beacon-60s"
  },
  "findings": [
    {
      "code_system": "MITRE",
      "code": "T1071.001",
      "display": "Application Layer Protocol: Web",
      "confidence": 0.74,
      "evidence_refs": ["beacon_pattern", "low_entropy_payload"]
    }
  ],
  "provenance": {
    "producer_model_id": "cicflowmeter",
    "producer_version": "4.0.1",
    "preprocessing_chain": ["tap_capture", "bidirectional_flow_assembly", "entropy_calc"],
    "calibration_id": "baseline-2026Q2",
    "created_at": "2026-04-12T12:01:14Z",
    "quality_flags": []
  },
  "text_view": "Egress TCP flow from pseudo-7f3c-a42b to 203.0.113.4:443 over 12h. 1438 bidirectional packets, periodic inter-arrival mean 60.4s (jitter 1.8s), low payload entropy 4.2 bits/byte. Anomaly score 0.74 at p99 of baseline; cluster beacon-60s. Candidate MITRE T1071.001 (Web app-layer beaconing)."
}
